{
  "$schema": "https://json-schema.org/draft/2020-12/schema",
  "$id": "https://schemas.socioprophet.ai/exodus/0.1.0/conversation-reuse-policy.schema.json",
  "type": "object",
  "required": [
    "id",
    "kind",
    "specVersion",
    "sourceConversationRef",
    "reuseMode",
    "redactionRequired",
    "citationRequired",
    "treatModelOutputsAsHistorical",
    "updatedAtUtc"
  ],
  "properties": {
    "id": { "type": "string" },
    "kind": { "const": "ConversationReusePolicy" },
    "specVersion": { "type": "string", "pattern": "^0\\.1\\.\\d+$" },
    "sourceConversationRef": { "type": "string" },
    "reuseMode": {
      "type": "string",
      "enum": ["read-only-document", "citation-source", "retrieval-context", "memory-candidate", "blocked"]
    },
    "redactionRequired": { "type": "boolean" },
    "citationRequired": { "type": "boolean" },
    "treatModelOutputsAsHistorical": { "type": "boolean" },
    "allowedTargets": {
      "type": "array",
      "items": {
        "type": "string",
        "enum": ["exodus-dashboard", "sourceos-chat", "workspace-search", "knowledge-context", "proof-pack", "none"]
      }
    },
    "blockedReasons": {
      "type": "array",
      "items": { "type": "string" }
    },
    "notes": { "type": "string" },
    "updatedAtUtc": { "type": "string", "format": "date-time" }
  },
  "additionalProperties": false
}
